{
  "schema_version": "1.0.0",
  "fixture_data": true,
  "task_id": "media_aaaaaaaaaaaaaaaaaaaaaaaaaaaaaaaa",
  "source": {
    "original_name": "fixture.mp4",
    "sha256": "aaaaaaaaaaaaaaaaaaaaaaaaaaaaaaaaaaaaaaaaaaaaaaaaaaaaaaaaaaaaaaaa",
    "size_bytes": 41000,
    "managed_original_path": "C:\\fixtures\\workspace\\originals\\aa\\fixture.mp4"
  },
  "media": {
    "duration_ms": 6000,
    "width": 360,
    "height": 640,
    "fps": 25,
    "video_codec": "h264",
    "audio_codec": "aac",
    "has_audio": true,
    "format_name": "mov,mp4"
  },
  "artifacts": {
    "proxy_path": "C:\\fixtures\\workspace\\tasks\\media_aaaaaaaaaaaaaaaaaaaaaaaaaaaaaaaa\\proxy.mp4",
    "audio_path": "C:\\fixtures\\workspace\\tasks\\media_aaaaaaaaaaaaaaaaaaaaaaaaaaaaaaaa\\audio.wav",
    "transcript_path": "C:\\fixtures\\workspace\\tasks\\media_aaaaaaaaaaaaaaaaaaaaaaaaaaaaaaaa\\transcript.json",
    "scene_manifest_path": "C:\\fixtures\\workspace\\tasks\\media_aaaaaaaaaaaaaaaaaaaaaaaaaaaaaaaa\\scenes.json"
  },
  "asr": {
    "status": "completed",
    "model_name": "ggml-tiny.bin",
    "language": "auto",
    "segment_count": 2
  },
  "shots": [
    {
      "id": "shot_001",
      "start_ms": 0,
      "end_ms": 2000,
      "scene_score": 0,
      "keyframe_path": "C:\\fixtures\\workspace\\keyframes\\shot-001.jpg"
    },
    {
      "id": "shot_002",
      "start_ms": 2000,
      "end_ms": 6000,
      "scene_score": 21.094,
      "keyframe_path": "C:\\fixtures\\workspace\\keyframes\\shot-002.jpg"
    }
  ],
  "timings_ms": {
    "probe": 40,
    "proxy": 120,
    "asr": 2000
  },
  "created_at": "2026-08-29T06:00:03Z"
}
